<?xml version="1.0" encoding="ISO-8859-1" ?>

<!DOCTYPE web-search-config PUBLIC 
"-//Maisis//DTD Web Search Config 1.5//EN" 
"http://www.maisis.pt/search/dtds/web-search-config_1_5.dtd">

<web-search-config>

  <exporter
      name="exporter"
      class="pt.maisis.search.export.jfreereport.SearchResultExporter"
      velocity="true"
      template="search-jfreereport.xml"/>

  <search
      name="search1"
      search-form="searchForm"
      search-form-scope="session"
      search-view="search1.jsp"
      result-view="exporter">
    <result-view format="html" name="search1.jsp"/>
  </search>

  <search 
      name="search2"
      search-form="searchForm"
      search-form-scope="session"
      search-view="search2.jsp"
      result-view="exporter"
      count="10"
      select-all-result-params="true">
    <result-view format="html" name="search2.jsp"/>
  </search>

  <search 
      name="search3"
      search-form="searchForm"
      search-form-scope="session"
      search-view="search3.jsp"
      result-view="exporter"
      count="10"
      select-all-result-params="true">
    <result-view format="html" name="search3.jsp"/>
  </search>
</web-search-config>